Mesh is refined between the two boundaries [m]:  (0.4, 0.8)
The simulation proceeds with default topology: constant area
Boundary Conditions Left:                    transparent
Boundary Conditions Right:                   transparent
================================================================================

================================================================================
                         🚀  WELCOME TO PYSHOCKTUBE 🚀
                  Fluid Dynamics Simulation for Shock Tubes
================================================================================

================================================================================
                                SIMULATION DATA
Length of the domain [m]:                    1.000000e+00
Number of points:                            100
Final time instant [s]:                      2.500000e-01
Fluid name:                                  Air
Fluid treatment:                             ideal
Fluid cp/cv ratio [-]:                       1.400000e+00
Fluid gas constant [J/kgK]:                  2.870500e+02
Initial L/R density values [kg/m3]:          (1.000000e+00, 1.250000e-01)
Initial L/R velocity values [m/s]:           (0.000000e+00, 0.000000e+00)
Initial L/R pressure values [Pa]:            (1.000000e+00, 1.000000e-01)
Initial L/R temperature values [K]:          (3.483714e-03, 2.786971e-03)
Initial L/R energy values [J/kg]:            (2.500000e+00, 2.000000e+00)

================================================================================
                                 START SOLVER
Numerical flux method: roe
MUSCL reconstruction: False
Entropy fix active: True
Ideal Gas model
Entropy fix coefficient: 0.2
================================================================================

Iteration: 1, Progress in Time 3.043 %
Iteration: 2, Progress in Time 4.851 %
Iteration: 3, Progress in Time 6.545 %
Iteration: 4, Progress in Time 8.253 %
Iteration: 5, Progress in Time 9.912 %
Iteration: 6, Progress in Time 11.577 %
Iteration: 7, Progress in Time 13.243 %
Iteration: 8, Progress in Time 14.895 %
Iteration: 9, Progress in Time 16.556 %
Iteration: 10, Progress in Time 18.211 %
Iteration: 11, Progress in Time 19.861 %
Iteration: 12, Progress in Time 21.519 %
Iteration: 13, Progress in Time 23.169 %
Iteration: 14, Progress in Time 24.818 %
Iteration: 15, Progress in Time 26.470 %
Iteration: 16, Progress in Time 28.117 %
Iteration: 17, Progress in Time 29.765 %
Iteration: 18, Progress in Time 31.412 %
Iteration: 19, Progress in Time 33.058 %
Iteration: 20, Progress in Time 34.705 %
Iteration: 21, Progress in Time 36.351 %
Iteration: 22, Progress in Time 37.995 %
Iteration: 23, Progress in Time 39.640 %
Iteration: 24, Progress in Time 41.284 %
Iteration: 25, Progress in Time 42.928 %
Iteration: 26, Progress in Time 44.572 %
Iteration: 27, Progress in Time 46.215 %
Iteration: 28, Progress in Time 47.858 %
Iteration: 29, Progress in Time 49.501 %
Iteration: 30, Progress in Time 51.144 %
Iteration: 31, Progress in Time 52.786 %
Iteration: 32, Progress in Time 54.429 %
Iteration: 33, Progress in Time 56.071 %
Iteration: 34, Progress in Time 57.713 %
Iteration: 35, Progress in Time 59.356 %
Iteration: 36, Progress in Time 60.998 %
Iteration: 37, Progress in Time 62.640 %
Iteration: 38, Progress in Time 64.282 %
Iteration: 39, Progress in Time 65.924 %
Iteration: 40, Progress in Time 67.567 %
Iteration: 41, Progress in Time 69.209 %
Iteration: 42, Progress in Time 70.851 %
Iteration: 43, Progress in Time 72.493 %
Iteration: 44, Progress in Time 74.135 %
Iteration: 45, Progress in Time 75.777 %
Iteration: 46, Progress in Time 77.419 %
Iteration: 47, Progress in Time 79.061 %
Iteration: 48, Progress in Time 80.703 %
Iteration: 49, Progress in Time 82.345 %
Iteration: 50, Progress in Time 83.987 %
Iteration: 51, Progress in Time 85.630 %
Iteration: 52, Progress in Time 87.272 %
Iteration: 53, Progress in Time 88.916 %
Iteration: 54, Progress in Time 90.559 %
Iteration: 55, Progress in Time 92.204 %
Iteration: 56, Progress in Time 93.851 %
Iteration: 57, Progress in Time 95.499 %
Iteration: 58, Progress in Time 97.149 %
Iteration: 59, Progress in Time 98.802 %
Iteration: 60, Progress in Time 100.000 %
                                  END SOLVER
================================================================================
                         FINAL ASSEMBLY OF THE RESULTS
Regrouping all the results in a single file...
Reading File 1 of 61
Reading File 2 of 61
Reading File 3 of 61
Reading File 4 of 61
Reading File 5 of 61
Reading File 6 of 61
Reading File 7 of 61
Reading File 8 of 61
Reading File 9 of 61
Reading File 10 of 61
Reading File 11 of 61
Reading File 12 of 61
Reading File 13 of 61
Reading File 14 of 61
Reading File 15 of 61
Reading File 16 of 61
Reading File 17 of 61
Reading File 18 of 61
Reading File 19 of 61
Reading File 20 of 61
Reading File 21 of 61
Reading File 22 of 61
Reading File 23 of 61
Reading File 24 of 61
Reading File 25 of 61
Reading File 26 of 61
Reading File 27 of 61
Reading File 28 of 61
Reading File 29 of 61
Reading File 30 of 61
Reading File 31 of 61
Reading File 32 of 61
Reading File 33 of 61
Reading File 34 of 61
Reading File 35 of 61
Reading File 36 of 61
Reading File 37 of 61
Reading File 38 of 61
Reading File 39 of 61
Reading File 40 of 61
Reading File 41 of 61
Reading File 42 of 61
Reading File 43 of 61
Reading File 44 of 61
Reading File 45 of 61
Reading File 46 of 61
Reading File 47 of 61
Reading File 48 of 61
Reading File 49 of 61
Reading File 50 of 61
Reading File 51 of 61
Reading File 52 of 61
Reading File 53 of 61
Reading File 54 of 61
Reading File 55 of 61
Reading File 56 of 61
Reading File 57 of 61
Reading File 58 of 61
Reading File 59 of 61
Reading File 60 of 61
Reading File 61 of 61
Replacing all individual files with a single pickle (this could take a while) ...
Regrouped all the times in a single file: Results/refined_NX_100/Results.pik
                                  END ASSEMBLER
================================================================================
